{
  "as_of": "2026-10-29T23:59:59Z",
  "candidate_quantities": [
    "confirmed_cases"
  ],
  "excluded_fields": [
    "point_estimate",
    "predictive_intervals",
    "model_parameters",
    "calculation_components",
    "private_source_inputs"
  ],
  "future_public_fields": [
    "nowcast_id",
    "quantity",
    "issued_at",
    "resolution_date",
    "status",
    "resolved_value",
    "score_after_resolution",
    "commitment_hash"
  ],
  "outbreak_id": "bdbv-uga-cod-2026",
  "public_role": "Document the standing scored-nowcast shape without publishing model internals.",
  "readiness": {
    "headline_data_as_of": "2026-10-29",
    "measured_latency_rows": 26,
    "open_calibration_commitments": 142
  },
  "schema_version": "1.0",
  "status": "interface_defined_not_issued_for_this_snapshot"
}
